{"adjudications":[],"artifact":{"evidence_type":"governed_artifact","path":"milestones/M2_annotated_references.md","root":{"discovery":"explicit:reviews/.harness/fixtures/m2-initial/synthetic-project-manifest.json","identity":"c2-synthetic-project","kind":"project","manifest_sha256":"edada29a91002a6d597c4ae19300f2fbb59e5f77b22882eebc4f4d43dcf3cb34"},"sha256":"9a37c5f81f60367abf798f64e37babf1db948b88e6703fb9c9a156b60031b062"},"corpus_binding_sha256":"4bc7c8d07046493d9b4de5eaab1b47cf27574cb7785e466cbc1f02f9de301125","detector":{"name":"product-assurance-semantic-candidates","version":"3.0.0"},"dimensions":{"citation":"passed","grounding":"passed","quotation":"passed","register":"passed"},"findings":[],"kernel_output_sha256":"db04aeca8cbbfe1c4ec57ad1fcf40332591a28b33a9c07648f14978d0931a41a","product_disposition":"product_qualified","qualification_mode":"governed_v3","report_type":"product_assurance","schema_version":"2.0.0","semantic_receipt":{"evidence_type":"semantic_execution_receipt","path":"reviews/.harness/verifier/m2-initial/evaluation-semantic.json","root":{"discovery":"explicit:reviews/.harness/fixtures/m2-initial/synthetic-project-manifest.json","identity":"c2-synthetic-project","kind":"project","manifest_sha256":"edada29a91002a6d597c4ae19300f2fbb59e5f77b22882eebc4f4d43dcf3cb34"},"sha256":"1d581517d1367df1fb615a6fa3ee3d6bc46dfc817aef32c5e9d935c05cab286f"},"semantics_digest":"741fb98b65213223dc0a6f7a51963bb4f68090462992062f8415a9d16c8a3342","status":"passed"}
