{"adjudications":[],"artifact":{"evidence_type":"governed_artifact","path":"research_notes/m4_deliverable.md","root":{"discovery":"explicit:reviews/.harness/fixtures/terminal-m4/synthetic-project-manifest.json","identity":"c2-synthetic-project","kind":"project","manifest_sha256":"b69a685b15d63c31d94537bce504752dc9bee4f94ff59e2700bba1f7ac17301e"},"sha256":"d406bdac4738ce8a1836fe58925e43b90378596e8fc38263e82402b2b5d07ec5"},"corpus_binding_sha256":"d1b2f2b4f210646a7d00215f7e9294c6a37cdbc6aa260bbc4e5bec29e4d74d6b","detector":{"name":"product-assurance-semantic-candidates","version":"3.0.0"},"dimensions":{"citation":"passed","grounding":"passed","quotation":"passed","register":"passed"},"findings":[],"kernel_output_sha256":"f1f0b1c52460c40b6ca4f27f4f4dcbc7200297a60d5f11badc9ec656e160a2d1","product_disposition":"product_qualified","qualification_mode":"governed_v3","report_type":"product_assurance","schema_version":"2.0.0","semantic_receipt":{"evidence_type":"semantic_execution_receipt","path":"reviews/.harness/verifier/terminal-m4/evaluation-semantic.json","root":{"discovery":"explicit:reviews/.harness/fixtures/terminal-m4/synthetic-project-manifest.json","identity":"c2-synthetic-project","kind":"project","manifest_sha256":"b69a685b15d63c31d94537bce504752dc9bee4f94ff59e2700bba1f7ac17301e"},"sha256":"5b66f4de721d929f2767df2d2b1cc6ea991114a87d45312957ebe220a7ac8bdc"},"semantics_digest":"741fb98b65213223dc0a6f7a51963bb4f68090462992062f8415a9d16c8a3342","status":"passed"}
